{
  "context": {
    "artifacts": [
      "/home/graham/workspace/experiments/tau/experiments/goal-locked-subagents/proofs/issue-31-streaming-image-wrapper-20260629T172705Z/scillm-panel",
      "/home/graham/workspace/experiments/tau/experiments/goal-locked-subagents/proofs/issue-31-streaming-image-wrapper-20260629T172705Z/command-loop/command-artifacts/command-loop-step-001/panel_creator_receipt.json",
      "/home/graham/workspace/experiments/tau/experiments/goal-locked-subagents/proofs/issue-31-streaming-image-wrapper-20260629T172705Z/scillm-panel/panel_001.png",
      "/home/graham/workspace/experiments/tau/experiments/goal-locked-subagents/proofs/issue-31-streaming-image-wrapper-20260629T172705Z/command-loop/command-artifacts/command-loop-step-002/panel_reviewer_receipt.json",
      "/home/graham/workspace/experiments/tau/experiments/goal-locked-subagents/proofs/issue-31-streaming-image-wrapper-20260629T172705Z/command-loop/command-artifacts/command-loop-step-002/visual_review_receipt.json",
      "/home/graham/workspace/experiments/tau/experiments/goal-locked-subagents/proofs/issue-31-streaming-image-wrapper-20260629T172705Z/command-loop/command-artifacts/command-loop-step-003/panel_repair_gate_receipt.json"
    ],
    "persona_dream_panel": {
      "image_path": "/home/graham/workspace/experiments/tau/experiments/goal-locked-subagents/proofs/issue-31-streaming-image-wrapper-20260629T172705Z/scillm-panel/panel_001.png",
      "panel_id": "panel_001",
      "panel_prompt": "Single photorealistic cinematic panel: one focused project agent at a desk reviewing evidence receipts, laptop glow, paper proof cards, tea steam, subtle surreal sky-eye outside window. No text, no logos, no captions, no UI chrome.",
      "run_root": "/home/graham/workspace/experiments/tau/experiments/goal-locked-subagents/proofs/issue-31-streaming-image-wrapper-20260629T172705Z/scillm-panel",
      "scillm_base_url": "http://127.0.0.1:4001",
      "scillm_image_auth": "codex-oauth",
      "scillm_image_model": "gpt-image-2",
      "scillm_image_quality": "medium",
      "scillm_live_panel": "true",
      "scillm_vlm_model": "gpt-5.5",
      "visual_review_receipt": "/home/graham/workspace/experiments/tau/experiments/goal-locked-subagents/proofs/issue-31-streaming-image-wrapper-20260629T172705Z/scillm-panel/visual_review_receipt.json"
    },
    "summary": "Repair gate consolidated persona-dream panel evidence and blocked provider readiness."
  },
  "github": {
    "repo": "grahama1970/tau",
    "target": "issue#31"
  },
  "goal": {
    "goal_hash": "sha256:issue31persona000000000000000000000000000000000000000000000000",
    "goal_id": "goal-tau-issue-27-persona-dream-panel-proof",
    "goal_version": 1
  },
  "next_agent": {
    "executor": "human",
    "name": "human",
    "reason": "Human or outer Persona-Dream harness must supply a public media URL and explicit Kling approval before live submission."
  },
  "previous_subagent": "persona-dream-panel-repair-gate",
  "rationale": "The bounded one-panel command chain has produced receipts and reached the first real blocker: independent live visual/generation evidence is absent.",
  "required_evidence": [
    "Concrete one-panel work order plus real creator, visual reviewer, no-overlay, and loop final receipts."
  ],
  "result": {
    "evidence": [
      "/home/graham/workspace/experiments/tau/experiments/goal-locked-subagents/proofs/issue-31-streaming-image-wrapper-20260629T172705Z/command-loop/command-artifacts/command-loop-step-003/panel_repair_gate_receipt.json",
      "/home/graham/workspace/experiments/tau/experiments/goal-locked-subagents/proofs/issue-31-streaming-image-wrapper-20260629T172705Z/command-loop/command-artifacts/command-loop-step-003/one_scene_kling_request.json"
    ],
    "status": "COMPLETED",
    "summary": "Persona Dream Panel Repair Gate wrote a dry-run one-scene Kling request; no public upload, Kling call, paid call, or live provider-ready claim occurred."
  },
  "schema": "tau.agent_handoff.v1",
  "stop_condition": "Human provides missing one-panel evidence or routes to a live repair attempt."
}
