{
  "context": {
    "artifacts": [
      "/home/graham/workspace/experiments/tau/experiments/goal-locked-subagents/proofs/issue-50-project-dag-panel-context-20260704T2235Z/phase-07-panel-context.dag.json",
      "/home/graham/workspace/experiments/tau/experiments/goal-locked-subagents/proofs/issue-50-project-dag-panel-context-20260704T2235Z/dag-run/command-loop/command-artifacts/command-loop-step-001/panel_creator_receipt.json",
      "/home/graham/workspace/experiments/tau/experiments/goal-locked-subagents/proofs/issue-50-project-dag-panel-context-20260704T2235Z/active-persona-dream-run/artifacts/active_panel_001.png"
    ],
    "persona_dream_panel": {
      "image_path": "/home/graham/workspace/experiments/tau/experiments/goal-locked-subagents/proofs/issue-50-project-dag-panel-context-20260704T2235Z/active-persona-dream-run/artifacts/active_panel_001.png",
      "panel_id": "panel_issue_50",
      "panel_prompt": "Issue 50 active Embry/Kai storyboard panel context, not DEFAULT_FIXTURE_ROOT.",
      "post_generation_script_coverage": "/home/graham/workspace/experiments/tau/experiments/goal-locked-subagents/proofs/issue-50-project-dag-panel-context-20260704T2235Z/active-persona-dream-run/receipts/post_generation_script_coverage_receipt.json",
      "run_root": "/home/graham/workspace/experiments/tau/experiments/goal-locked-subagents/proofs/issue-50-project-dag-panel-context-20260704T2235Z/active-persona-dream-run",
      "source_script_coverage": "/home/graham/workspace/experiments/tau/experiments/goal-locked-subagents/proofs/issue-50-project-dag-panel-context-20260704T2235Z/active-persona-dream-run/receipts/script_coverage_receipt.json",
      "visual_review_receipt": "/home/graham/workspace/experiments/tau/experiments/goal-locked-subagents/proofs/issue-50-project-dag-panel-context-20260704T2235Z/active-persona-dream-run/receipts/visual_review_receipt.json",
      "write_receipts_to_panel_run_root": "true"
    },
    "summary": "Panel Creator locked a one-panel local reference artifact for review."
  },
  "github": {
    "repo": "grahama1970/tau",
    "target": "issue#50"
  },
  "goal": {
    "goal_hash": "sha256:issue-50-panel-context-smoke",
    "goal_id": "tau-issue-50",
    "goal_version": 1
  },
  "next_agent": {
    "executor": "local",
    "name": "panel-reviewer",
    "reason": "Panel Reviewer must inspect or fail closed on the creator receipt."
  },
  "previous_subagent": "panel-creator",
  "rationale": "A concrete local panel artifact and creator receipt now exist, so the next bounded step is independent panel review.",
  "required_evidence": [
    "Panel Reviewer writes panel_reviewer_receipt.json or visual_review_receipt evidence."
  ],
  "result": {
    "evidence": [
      "/home/graham/workspace/experiments/tau/experiments/goal-locked-subagents/proofs/issue-50-project-dag-panel-context-20260704T2235Z/dag-run/command-loop/command-artifacts/command-loop-step-001/panel_creator_receipt.json",
      "/home/graham/workspace/experiments/tau/experiments/goal-locked-subagents/proofs/issue-50-project-dag-panel-context-20260704T2235Z/active-persona-dream-run/artifacts/active_panel_001.png sha256:5620cf0425cc13d2e5de8cd05b09484ae1c5af280d1cb4d306f9741d48f52c24"
    ],
    "status": "COMPLETED",
    "summary": "Panel Creator wrote a local panel_creator_receipt with image artifact path and hash; no public upload or Kling call occurred."
  },
  "schema": "tau.agent_handoff.v1",
  "stop_condition": "Panel Reviewer emits a Tau handoff with receipt paths."
}
